{
  "version": 1,
  "cafeterias": [
    {
      "id": 1,
      "name": "云天苑食堂",
      "sortOrder": 1,
      "enabled": true
    },
    {
      "id": 2,
      "name": "翱翔食堂",
      "sortOrder": 2,
      "enabled": true
    },
    {
      "id": 3,
      "name": "星天苑美食广场",
      "sortOrder": 3,
      "enabled": true
    }
  ],
  "floors": [
    {
      "id": 101,
      "cafeteriaId": 1,
      "name": "1楼",
      "sortOrder": 1,
      "enabled": true
    },
    {
      "id": 102,
      "cafeteriaId": 1,
      "name": "2楼",
      "sortOrder": 2,
      "enabled": true
    },
    {
      "id": 201,
      "cafeteriaId": 2,
      "name": "1楼",
      "sortOrder": 1,
      "enabled": true
    },
    {
      "id": 202,
      "cafeteriaId": 2,
      "name": "2楼",
      "sortOrder": 2,
      "enabled": true
    },
    {
      "id": 301,
      "cafeteriaId": 3,
      "name": "1楼",
      "sortOrder": 1,
      "enabled": true
    }
  ],
  "meals": [
    {
      "id": 1001,
      "floorId": 101,
      "name": "黄焖鸡米饭",
      "tags": "快餐,适中,￥18",
      "enabled": true
    },
    {
      "id": 1002,
      "floorId": 101,
      "name": "兰州牛肉面",
      "tags": "面食,清淡,￥15",
      "enabled": true
    },
    {
      "id": 1003,
      "floorId": 102,
      "name": "麻辣烫",
      "tags": "粉面,微辣,￥17",
      "enabled": true
    },
    {
      "id": 1004,
      "floorId": 201,
      "name": "自选小碗菜",
      "tags": "自选,均衡,￥20",
      "enabled": true
    },
    {
      "id": 1005,
      "floorId": 201,
      "name": "重庆小面",
      "tags": "面食,辣,￥16",
      "enabled": true
    },
    {
      "id": 1006,
      "floorId": 202,
      "name": "砂锅米线",
      "tags": "粉面,清淡,￥19",
      "enabled": true
    },
    {
      "id": 1007,
      "floorId": 301,
      "name": "鸡公煲",
      "tags": "香锅,重口味,￥28",
      "enabled": true
    },
    {
      "id": 1008,
      "floorId": 301,
      "name": "轻食沙拉",
      "tags": "轻食,清淡,￥24",
      "enabled": true
    }
  ]
}
